{
  "message_id": "33333333-3333-4333-8333-333333333339",
  "message_type": "agent.action.proposed",
  "schema_version": 1,
  "occurred_at": "2026-10-11T09:00:00Z",
  "producer": "agent-py",
  "payload": {
    "event_sequence": 6,
    "run_id": "aaaaaaa1-0000-4000-8000-000000000001",
    "proposal_id": "prop-1",
    "article_id": "my-blog-post",
    "article_revision": 7,
    "base_content_hash": "9f86d081884c7d659a2feaa0c55ad015a3bf4f1b2b0b822cd15d6c15b0f00a08",
    "summary": "Giris paragrafi sikilastirmasi",
    "proposed_content": "Yeni giris paragrafi ...",
    "created_at": "2026-10-11T09:04:20Z"
  },
  "correlation_id": "ccccccc1-0000-4000-8000-000000000003",
  "run_id": "aaaaaaa1-0000-4000-8000-000000000001",
  "conversation_id": "bbbbbbb1-0000-4000-8000-000000000002",
  "trace_context": "00-4bf92f3577b34da6a3ce929d0e0e4736-00f067aa0ba902b7-01"
}
