{
  "message_id": "44444444-4444-4444-8444-444444444444",
  "message_type": "content.sync.completed",
  "schema_version": 1,
  "occurred_at": "2026-10-11T09:00:00Z",
  "producer": "backend-net",
  "payload": {
    "sync_id": "sync-2026-10-11-001",
    "item_count": 2
  },
  "correlation_id": "ccccccc1-0000-4000-8000-000000000003",
  "trace_context": "00-4bf92f3577b34da6a3ce929d0e0e4736-00f067aa0ba902b7-01"
}
