{
  "message_id": "33333333-3333-4333-8333-333333333335",
  "message_type": "agent.run.completed",
  "schema_version": 1,
  "occurred_at": "2026-10-11T09:00:00Z",
  "producer": "agent-py",
  "payload": {
    "event_sequence": 7,
    "execution_attempt": 1,
    "fencing_token": "lease-0007",
    "selected_mode": "deep_research",
    "answer": "Raporun ozeti ...",
    "citations": [
      {
        "kind": "article",
        "article_id": "my-blog-post",
        "article_revision": 7,
        "chunk_index": 2
      },
      {
        "kind": "web",
        "url": "https://example.com/source",
        "accessed_at": "2026-10-11T09:04:11Z"
      }
    ],
    "source_scope": "article_and_web",
    "unresolved_questions": [
      "Kaynak erisimi sinirliydi"
    ],
    "usage": {
      "run_id": "aaaaaaa1-0000-4000-8000-000000000001",
      "model_calls": 5,
      "prompt_tokens": 4200,
      "completion_tokens": 1100,
      "total_tokens": 5300,
      "tool_calls": 3,
      "web_search_calls": 2,
      "duration_seconds": 42.5,
      "recorded_at": "2026-10-11T09:04:30Z"
    },
    "action_proposal": {
      "run_id": "aaaaaaa1-0000-4000-8000-000000000001",
      "proposal_id": "prop-1",
      "article_id": "my-blog-post",
      "article_revision": 7,
      "base_content_hash": "9f86d081884c7d659a2feaa0c55ad015a3bf4f1b2b0b822cd15d6c15b0f00a08",
      "summary": "Giris paragrafi sikilastirmasi",
      "proposed_content": "Yeni giris paragrafi ...",
      "created_at": "2026-10-11T09:04:20Z"
    }
  },
  "correlation_id": "ccccccc1-0000-4000-8000-000000000003",
  "run_id": "aaaaaaa1-0000-4000-8000-000000000001",
  "conversation_id": "bbbbbbb1-0000-4000-8000-000000000002",
  "trace_context": "00-4bf92f3577b34da6a3ce929d0e0e4736-00f067aa0ba902b7-01"
}
