{
  "message_id": "44444444-4444-4444-8444-444444444441",
  "message_type": "content.article.changed",
  "schema_version": 1,
  "occurred_at": "2026-10-11T09:00:00Z",
  "producer": "backend-net",
  "payload": {
    "article_id": "my-blog-post",
    "article_revision": 8,
    "action": "updated",
    "content_hash": "2c26b46b68ffc68ff99b453c1d30413413422d706483bfa0f98a5e886266e7ae",
    "language": "tr",
    "title": "Guncellenmis baslik"
  },
  "correlation_id": "ccccccc1-0000-4000-8000-000000000003",
  "trace_context": "00-4bf92f3577b34da6a3ce929d0e0e4736-00f067aa0ba902b7-01"
}
