{
  "message_id": "22222222-2222-4222-8222-222222222222",
  "message_type": "agent.resume.requested",
  "schema_version": 1,
  "occurred_at": "2026-10-11T09:00:00Z",
  "producer": "backend-net",
  "payload": {
    "checkpoint_reference": "agent/checkpoint/aaaaaaa1-0000-4000-8000-000000000001/attempt-1",
    "user_ref": "user-42"
  },
  "correlation_id": "ccccccc1-0000-4000-8000-000000000003",
  "run_id": "aaaaaaa1-0000-4000-8000-000000000001",
  "conversation_id": "bbbbbbb1-0000-4000-8000-000000000002",
  "causation_id": "ddddddd1-0000-4000-8000-000000000004",
  "trace_context": "00-4bf92f3577b34da6a3ce929d0e0e4736-00f067aa0ba902b7-01"
}
