{
  "message_id": "33333333-3333-4333-8333-333333333338",
  "message_type": "agent.run.cancelled",
  "schema_version": 1,
  "occurred_at": "2026-10-11T09:00:00Z",
  "producer": "agent-py",
  "payload": {
    "event_sequence": 6,
    "reason": "Kullanici iptal etti",
    "usage": {
      "run_id": "aaaaaaa1-0000-4000-8000-000000000001",
      "model_calls": 5,
      "prompt_tokens": 4200,
      "completion_tokens": 1100,
      "total_tokens": 5300,
      "tool_calls": 3,
      "web_search_calls": 2,
      "duration_seconds": 42.5,
      "recorded_at": "2026-10-11T09:04:30Z"
    }
  },
  "correlation_id": "ccccccc1-0000-4000-8000-000000000003",
  "run_id": "aaaaaaa1-0000-4000-8000-000000000001",
  "conversation_id": "bbbbbbb1-0000-4000-8000-000000000002",
  "trace_context": "00-4bf92f3577b34da6a3ce929d0e0e4736-00f067aa0ba902b7-01"
}
